{"PowerCacheData":{"callId":"00000000-0000-0000-0000-000000000000","time":"\/Date(-62135596800000)\/","messageHeader":null,"asOfDate":"\/Date(1785045599000)\/","generation":3124,"netInterchange":-93,"systemSupply":2876,"systemDemand":3031,"historicalPeakDemand":{"demand":3910,"date":"\/Date(1640822400000)\/"},"generationByType":[{"type":"Hydro","percentOfTotalGeneration":22,"totalGenerationForType":682,"powerUseFacilities":[{"name":"Wellington Power Station","URL":"https://www.saskpower.com/Our-Power-Future/Our-Electricity/Electrical-System/System-Map/Wellington-Power-Station"},{"name":"Waterloo Power Station","URL":"https://www.saskpower.com/Our-Power-Future/Our-Electricity/Electrical-System/System-Map/Waterloo-Power-Station"},{"name":"Charlot River Power Station","URL":"https://www.saskpower.com/Our-Power-Future/Our-Electricity/Electrical-System/System-Map/Charlot-River-Power-Station"},{"name":"Island Falls Hydroelectric Station","URL":"https://www.saskpower.com/Our-Power-Future/Our-Electricity/Electrical-System/System-Map/Island-Falls-Hydroelectric-Station"},{"name":"Nipawin Hydroelectric Station","URL":"https://www.saskpower.com/Our-Power-Future/Our-Electricity/Electrical-System/System-Map/Nipawin-Hydroelectric-Station"},{"name":"E.B. Campbell Hydroelectric Station","URL":"https://www.saskpower.com/Our-Power-Future/Our-Electricity/Electrical-System/System-Map/EB-Campbell-Hydroelectric-Station"},{"name":"Coteau Creek Hydroelectric Station","URL":"https://www.saskpower.com/Our-Power-Future/Our-Electricity/Electrical-System/System-Map/Coteau-Creek-Hydroelectric-Station"}],"greenEnergy":true},{"type":"Wind","percentOfTotalGeneration":5,"totalGenerationForType":159,"powerUseFacilities":[{"name":"Cypress Wind Power Facility","URL":"https://www.saskpower.com/Our-Power-Future/Our-Electricity/Electrical-System/System-Map/Cypress-Wind-Power-Facility"},{"name":"Centennial Wind Power Facility","URL":"https://www.saskpower.com/Our-Power-Future/Our-Electricity/Electrical-System/System-Map/Centennial-Wind-Power-Facility"},{"name":"Morse Wind Power Facility","URL":"https://www.saskpower.com/Our-Power-Future/Our-Electricity/Electrical-System/System-Map/Morse-Wind-Facility"},{"name":"Red Lily Wind Energy Facility","URL":"https://www.saskpower.com/Our-Power-Future/Our-Electricity/Electrical-System/System-Map/Red-Lily-Wind-Power-Facility"},{"name":"Western Lily Wind Power Facility","URL":"https://www.saskpower.com/Our-Power-Future/Our-Electricity/Electrical-System/System-Map/Western-Lily-Wind-Power-Facility"},{"name":"Riverhurst Wind Facility","URL":"https://www.saskpower.com/Our-Power-Future/Our-Electricity/Electrical-System/System-Map/Riverhurst-Wind-Facility"},{"name":"Golden South Wind Facility","URL":"https://www.saskpower.com/Our-Power-Future/Our-Electricity/Electrical-System/System-Map/Golden-South-Wind-Facility"},{"name":"Blue Hill Wind Facility","URL":"https://www.saskpower.com/Our-Power-Future/Our-Electricity/Electrical-System/System-Map/Blue-Hill-Wind-Facility"},{"name":"Bekevar Wind Facilty","URL":"https://www.saskpower.com/our-power-future/our-electricity/electrical-system/system-map/bekevar-wind-facility"}],"greenEnergy":true},{"type":"Solar","percentOfTotalGeneration":0,"totalGenerationForType":12,"powerUseFacilities":[{"name":"Highfield Solar Energy Facility","URL":"https://www.saskpower.com/Our-Power-Future/Our-Electricity/Electrical-System/System-Map/Highfield-Solar-Facility"},{"name":"Pesâkâstêw Solar Facility","URL":"https://www.saskpower.com/Our-Power-Future/Our-Electricity/Electrical-System/System-Map/Pesakastew-Solar-Facility"},{"name":"Awasis Solar Facility","URL":"https://www.saskpower.com/Our-Power-Future/Our-Electricity/Electrical-System/System-Map/Awasis-Solar-Facility"},{"name":"Descharme Lake Microgrid","URL":"https://www.saskpower.com/our-power-future/our-electricity/electrical-system/system-map/descharme-lake-microgrid"}],"greenEnergy":true},{"type":"Natural Gas","percentOfTotalGeneration":38,"totalGenerationForType":1202,"powerUseFacilities":[{"name":"Meadow Lake Power Station","URL":"https://www.saskpower.com/Our-Power-Future/Our-Electricity/Electrical-System/System-Map/Meadow-Lake-Power-Station"},{"name":"Meridian Cogeneration Station","URL":"https://www.saskpower.com/Our-Power-Future/Our-Electricity/Electrical-System/System-Map/Meridian-Cogeneration-Station"},{"name":"North Battleford Power Station","URL":"https://www.saskpower.com/Our-Power-Future/Our-Electricity/Electrical-System/System-Map/North-Battleford-Power-Station"},{"name":"Yellowhead Power Station","URL":"https://www.saskpower.com/Our-Power-Future/Our-Electricity/Electrical-System/System-Map/Yellowhead-Power-Station"},{"name":"Ermine Power Station","URL":"https://www.saskpower.com/Our-Power-Future/Our-Electricity/Electrical-System/System-Map/Ermine-Power-Station"},{"name":"Landis Power Station","URL":"https://www.saskpower.com/Our-Power-Future/Our-Electricity/Electrical-System/System-Map/Landis-Power-Station"},{"name":"Cory Cogeneration Station","URL":"https://www.saskpower.com/Our-Power-Future/Our-Electricity/Electrical-System/System-Map/Cory-Cogeneration-Station"},{"name":"Queen Elizabeth Power Station","URL":"https://www.saskpower.com/Our-Power-Future/Our-Electricity/Electrical-System/System-Map/Queen-Elizabeth-Power-Station"},{"name":"Spy Hill Power Station","URL":"https://www.saskpower.com/Our-Power-Future/Our-Electricity/Electrical-System/System-Map/Spy-Hill-Power-Station"},{"name":"Chinook Power Station","URL":"https://www.saskpower.com/Our-Power-Future/Our-Electricity/Electrical-System/System-Map/Chinook-Power-Station"},{"name":"Great Plains Power Station","URL":"https://www.saskpower.com/Our-Power-Future/Our-Electricity/Electrical-System/System-Map/Great-Plains-Power-Station"}],"greenEnergy":false},{"type":"Coal","percentOfTotalGeneration":33,"totalGenerationForType":1031,"powerUseFacilities":[{"name":"Poplar River Power Station","URL":"https://www.saskpower.com/Our-Power-Future/Our-Electricity/Electrical-System/System-Map/Poplar-River-Power-Station"},{"name":"Boundary Dam Power Station","URL":"https://www.saskpower.com/Our-Power-Future/Our-Electricity/Electrical-System/System-Map/Boundary-Dam-Power-Station"},{"name":"Shand Power Station","URL":"https://www.saskpower.com/Our-Power-Future/Our-Electricity/Electrical-System/System-Map/Shand-Power-Station"}],"greenEnergy":false},{"type":"Other","percentOfTotalGeneration":1,"totalGenerationForType":38,"powerUseFacilities":[{"name":"NRGreen Kerrobert Heat Recovery Facility","URL":"https://www.saskpower.com/Our-Power-Future/Our-Electricity/Electrical-System/System-Map/NRGreen-Kerrobert-Heat-Recovery-Facility"},{"name":"NRGreen Loreburn Heat Recovery Facility","URL":"https://www.saskpower.com/Our-Power-Future/Our-Electricity/Electrical-System/System-Map/NRGreen-Loreburn-Heat-Recovery-Facility"},{"name":"NRGreen Estlin Heat Recovery Facility","URL":"https://www.saskpower.com/Our-Power-Future/Our-Electricity/Electrical-System/System-Map/NRGreen-Estlin-Heat-Recovery-Facility"},{"name":"NRGreen Alameda Heat Recovery Facility","URL":"https://www.saskpower.com/Our-Power-Future/Our-Electricity/Electrical-System/System-Map/NRGreen-Alameda-Heat-Recovery-Facility"},{"name":"Manitoba Hydro","URL":""},{"name":"Small Independent Power Producers","URL":""},{"name":"Meadow Lake Tribal Council (MLTC) Bioenergy Centre","URL":"https://www.saskpower.com/our-power-future/infrastructure-projects/construction-projects/planning-and-construction-projects/mltc-bioenergy-centre"}],"greenEnergy":false}]},"PowerUsageDisplays":null,"SupplyDataText":"Jul 25, 2026","HistoricalPeakDemandDate":"Dec 30, 2021","ErrorMessage":null,"ErrorIcon":null,"AjaxURL":null,"ContextPage":null,"Id":"00000000-0000-0000-0000-000000000000","Language":null,"Uri":null,"DisplayName":null,"Version":0,"Path":null,"Name":null,"Url":null,"TemplateId":"00000000-0000-0000-0000-000000000000"}